{
  "schema_version": "1.1",
  "mapping_version": "2026-09-13.2",
  "provenance": {
    "reviewed_at": "2026-09-13",
    "review_process": "source_coordinate_and_rationale_review_v1",
    "canonical_sha256": "fc3ef6df01553677ac2cbc1d3b42b824d97be13e5742420258456ca5c65e59a4"
  },
  "relationship": "related",
  "disclaimer": "These evidence-to-control references indicate topical relationships only. They do not establish implementation, effectiveness, certification, or compliance.",
  "sources": [
    {
      "framework": "NIST CSF",
      "framework_version": "2.0",
      "url": "https://doi.org/10.6028/NIST.CSWP.29"
    },
    {
      "framework": "ISO/IEC 27001",
      "framework_version": "2022",
      "url": "https://www.iso.org/standard/27001"
    },
    {
      "framework": "AIDEFEND",
      "framework_version": "1.20260805",
      "url": "https://github.com/edward-playground/aidefense-framework/blob/e10c1678ee49f03f8fb0c97d446ba3fbc3543655/data/data.json"
    },
    {
      "framework": "OWASP Top 10",
      "framework_version": "2021",
      "url": "https://owasp.org/Top10/"
    },
    {
      "framework": "OWASP Top 10 for LLM Applications",
      "framework_version": "2025",
      "url": "https://genai.owasp.org/llm-top-10/"
    },
    {
      "framework": "CIS Kubernetes Benchmark",
      "framework_version": "1.11",
      "url": "https://www.cisecurity.org/benchmark/kubernetes"
    },
    {
      "framework": "CIS Amazon Web Services Foundations Benchmark",
      "framework_version": "3.0.0",
      "url": "https://www.cisecurity.org/benchmark/amazon_web_services"
    }
  ],
  "controls": [
    {
      "key": "nist-id-ra-01",
      "framework": "NIST CSF",
      "framework_version": "2.0",
      "control_id": "ID.RA-01",
      "title": "Vulnerability identification and recording"
    },
    {
      "key": "nist-pr-aa-01",
      "framework": "NIST CSF",
      "framework_version": "2.0",
      "control_id": "PR.AA-01",
      "title": "Identity and credential lifecycle management"
    },
    {
      "key": "nist-pr-aa-03",
      "framework": "NIST CSF",
      "framework_version": "2.0",
      "control_id": "PR.AA-03",
      "title": "Authentication of users, services, and hardware"
    },
    {
      "key": "nist-pr-aa-05",
      "framework": "NIST CSF",
      "framework_version": "2.0",
      "control_id": "PR.AA-05",
      "title": "Least-privilege access governance"
    },
    {
      "key": "nist-pr-ds-01",
      "framework": "NIST CSF",
      "framework_version": "2.0",
      "control_id": "PR.DS-01",
      "title": "Protection of data at rest"
    },
    {
      "key": "nist-pr-ps-01",
      "framework": "NIST CSF",
      "framework_version": "2.0",
      "control_id": "PR.PS-01",
      "title": "Configuration management practices"
    },
    {
      "key": "nist-pr-ps-04",
      "framework": "NIST CSF",
      "framework_version": "2.0",
      "control_id": "PR.PS-04",
      "title": "Security log availability"
    },
    {
      "key": "nist-pr-ps-06",
      "framework": "NIST CSF",
      "framework_version": "2.0",
      "control_id": "PR.PS-06",
      "title": "Secure software development practices"
    },
    {
      "key": "nist-pr-ir-01",
      "framework": "NIST CSF",
      "framework_version": "2.0",
      "control_id": "PR.IR-01",
      "title": "Protection of networks and environments from unauthorized access"
    },
    {
      "key": "nist-pr-ir-04",
      "framework": "NIST CSF",
      "framework_version": "2.0",
      "control_id": "PR.IR-04",
      "title": "Resource capacity for availability"
    },
    {
      "key": "iso-5-15",
      "framework": "ISO/IEC 27001",
      "framework_version": "2022",
      "control_id": "A.5.15",
      "title": "Policy-governed access"
    },
    {
      "key": "iso-5-17",
      "framework": "ISO/IEC 27001",
      "framework_version": "2022",
      "control_id": "A.5.17",
      "title": "Authentication information safeguards"
    },
    {
      "key": "iso-5-18",
      "framework": "ISO/IEC 27001",
      "framework_version": "2022",
      "control_id": "A.5.18",
      "title": "Access entitlement governance"
    },
    {
      "key": "iso-5-23",
      "framework": "ISO/IEC 27001",
      "framework_version": "2022",
      "control_id": "A.5.23",
      "title": "Cloud service security responsibilities"
    },
    {
      "key": "iso-8-2",
      "framework": "ISO/IEC 27001",
      "framework_version": "2022",
      "control_id": "A.8.2",
      "title": "Privileged access safeguards"
    },
    {
      "key": "iso-8-6",
      "framework": "ISO/IEC 27001",
      "framework_version": "2022",
      "control_id": "A.8.6",
      "title": "Capacity management"
    },
    {
      "key": "iso-8-8",
      "framework": "ISO/IEC 27001",
      "framework_version": "2022",
      "control_id": "A.8.8",
      "title": "Technical vulnerability handling"
    },
    {
      "key": "iso-8-9",
      "framework": "ISO/IEC 27001",
      "framework_version": "2022",
      "control_id": "A.8.9",
      "title": "Configuration management"
    },
    {
      "key": "iso-8-15",
      "framework": "ISO/IEC 27001",
      "framework_version": "2022",
      "control_id": "A.8.15",
      "title": "Security-relevant audit records"
    },
    {
      "key": "iso-8-20",
      "framework": "ISO/IEC 27001",
      "framework_version": "2022",
      "control_id": "A.8.20",
      "title": "Networks security"
    },
    {
      "key": "iso-8-24",
      "framework": "ISO/IEC 27001",
      "framework_version": "2022",
      "control_id": "A.8.24",
      "title": "Cryptographic safeguards"
    },
    {
      "key": "iso-8-28",
      "framework": "ISO/IEC 27001",
      "framework_version": "2022",
      "control_id": "A.8.28",
      "title": "Secure coding practices"
    },
    {
      "key": "iso-8-29",
      "framework": "ISO/IEC 27001",
      "framework_version": "2022",
      "control_id": "A.8.29",
      "title": "Security testing before acceptance"
    },
    {
      "key": "aidefend-h-003-001",
      "framework": "AIDEFEND",
      "framework_version": "1.20260805",
      "control_id": "AID-H-003.001",
      "title": "Software Dependency & Package Security",
      "applicability": "ai_system"
    },
    {
      "key": "aidefend-h-003-005",
      "framework": "AIDEFEND",
      "framework_version": "1.20260805",
      "control_id": "AID-H-003.005",
      "title": "Infrastructure as Code (IaC) Security Scanning for AI Systems",
      "applicability": "ai_system"
    },
    {
      "key": "aidefend-h-003-010",
      "framework": "AIDEFEND",
      "framework_version": "1.20260805",
      "control_id": "AID-H-003.010",
      "title": "Deployed AI Software Vulnerability Remediation Lifecycle",
      "applicability": "ai_system"
    },
    {
      "key": "aidefend-h-025-001",
      "framework": "AIDEFEND",
      "framework_version": "1.20260805",
      "control_id": "AID-H-025.001",
      "title": "Pre-Execution Static Analysis & Dangerous Construct Blocking",
      "applicability": "ai_system"
    },
    {
      "key": "aidefend-h-031-002",
      "framework": "AIDEFEND",
      "framework_version": "1.20260805",
      "control_id": "AID-H-031.002",
      "title": "Static Admission Gates for AI-Generated Artifacts",
      "applicability": "ai_generated_artifact"
    },
    {
      "key": "aidefend-i-001-001",
      "framework": "AIDEFEND",
      "framework_version": "1.20260805",
      "control_id": "AID-I-001.001",
      "title": "Container-Based Isolation",
      "applicability": "ai_system"
    },
    {
      "key": "owasp-2021-a01",
      "framework": "OWASP Top 10",
      "framework_version": "2021",
      "control_id": "A01:2021",
      "title": "Broken Access Control"
    },
    {
      "key": "owasp-2021-a02",
      "framework": "OWASP Top 10",
      "framework_version": "2021",
      "control_id": "A02:2021",
      "title": "Cryptographic Failures"
    },
    {
      "key": "owasp-2021-a03",
      "framework": "OWASP Top 10",
      "framework_version": "2021",
      "control_id": "A03:2021",
      "title": "Injection"
    },
    {
      "key": "owasp-2021-a04",
      "framework": "OWASP Top 10",
      "framework_version": "2021",
      "control_id": "A04:2021",
      "title": "Insecure Design"
    },
    {
      "key": "owasp-2021-a05",
      "framework": "OWASP Top 10",
      "framework_version": "2021",
      "control_id": "A05:2021",
      "title": "Security Misconfiguration"
    },
    {
      "key": "owasp-2021-a06",
      "framework": "OWASP Top 10",
      "framework_version": "2021",
      "control_id": "A06:2021",
      "title": "Vulnerable and Outdated Components"
    },
    {
      "key": "owasp-2021-a07",
      "framework": "OWASP Top 10",
      "framework_version": "2021",
      "control_id": "A07:2021",
      "title": "Identification and Authentication Failures"
    },
    {
      "key": "owasp-2021-a08",
      "framework": "OWASP Top 10",
      "framework_version": "2021",
      "control_id": "A08:2021",
      "title": "Software and Data Integrity Failures"
    },
    {
      "key": "owasp-2021-a09",
      "framework": "OWASP Top 10",
      "framework_version": "2021",
      "control_id": "A09:2021",
      "title": "Security Logging and Monitoring Failures"
    },
    {
      "key": "owasp-2021-a10",
      "framework": "OWASP Top 10",
      "framework_version": "2021",
      "control_id": "A10:2021",
      "title": "Server-Side Request Forgery (SSRF)"
    },
    {
      "key": "owasp-llm-2025-01",
      "framework": "OWASP Top 10 for LLM Applications",
      "framework_version": "2025",
      "control_id": "LLM01:2025",
      "title": "Prompt Injection",
      "applicability": "ai_system"
    },
    {
      "key": "owasp-llm-2025-02",
      "framework": "OWASP Top 10 for LLM Applications",
      "framework_version": "2025",
      "control_id": "LLM02:2025",
      "title": "Sensitive Information Disclosure",
      "applicability": "ai_system"
    },
    {